{
  "article_id": "LCM-SMOKE-20260811-01",
  "title": "分分彩前三直选怎么区分单式和复式？两种投注格式一次看懂",
  "seo_title": "分分彩前三直选：单式和复式投注格式、组合数量怎么区分",
  "slug": "ffc-qiansan-direct-single-vs-compound",
  "meta_description": "讲清分分彩前三直选单式与复式的格式区别：单式写完整三位号码，复式按三个位置拆分数字池，并用3×3×3案例说明组合数量。",
  "primary_keyword": "分分彩前三直选",
  "secondary_keywords": ["分分彩直选单式", "分分彩直选复式", "前三直选投注格式", "彩票投注技巧"],
  "search_intent": "了解分分彩前三直选单式与复式的格式区别和组合数量计算",
  "summary": "用079 707 796与089-145-689两个格式示例，说明前三直选单式和复式的解析方式、组合数量与常见误区。",
  "category": "投注技巧",
  "site_category_key": "tzjq",
  "content_type": "technique_article",
  "content_format": "html",
  "tags": ["分分彩前三直选", "直选单式", "直选复式", "投注格式"],
  "content": "<p>分分彩前三直选里，最容易写错的地方不是号码本身，而是把“直选单式”和“直选复式”当成同一种格式。本文只讲本站定码轮换系统采用的格式规则和组合数学，不代表所有平台的字段名称、计费方式完全一致。</p>\n<h2>先看最直接的区别</h2>\n<p><strong>直选单式</strong>是一注一注地写完整三位号码，用空格分隔。例如：<code>079 707 796</code>。这里有三个完整号码，每个号码都已经确定百、十、个三个位置。</p>\n<p><strong>直选复式</strong>不是把完整号码逐个列出来，而是给三个位置分别提供候选数字池，并用连字符分隔。例如：<code>089-145-689</code>。第一组属于第一个位置，第二组属于第二个位置，第三组属于第三个位置。</p>\n<h2>为什么复式不能按“3个号码”理解</h2>\n<p>以 <code>089-145-689</code> 为例，三个位置分别有3个候选数字。按有序三位结果展开，组合数量是 <code>3×3×3=27</code>。展开后的前几项可以写成 <code>016、018、019、046、048、049…</code>。这说明复式中的每一组是“位置候选池”，不是一条完整号码。</p>\n<p>固定三星直选的完整数学结果空间是 <code>10³=1000</code> 个有序结果。上面的27个组合只占其中2.7%。这个比例只是结果空间计算，不涉及任何平台的金额、返奖或收益判断。</p>\n<h2>单式为什么不能写成复式形式</h2>\n<p>单式的 <code>079</code> 表示一个确定的三位结果；如果把它拆成 <code>0-7-9</code>，虽然表面数字相同，语法已经变成三个位置各只有一个候选值的复式表达。系统解析器必须区分这两种输入，否则后续注数、去重和覆盖统计都会出现口径混乱。</p>\n<h2>一个简单检查方法</h2>\n<p>看到空格分隔的三位完整号码，如 <code>079 707 796</code>，先按“单式列表”理解；看到三个数字集合通过 <code>-</code> 连接，如 <code>089-145-689</code>，先按“三位置复式”理解。不要只数输入框里有多少段文字，而要先确认每一段代表“完整号码”还是“位置候选池”。</p>\n<h2>常见错误</h2>\n<ul><li>把 <code>089-145-689</code> 当成3注，而不是展开后的27个有序组合。</li><li>把 <code>079 707 796</code> 当成三个位置的候选池。</li><li>只看输入数字多少，不先确认玩法名称是“直选单式”还是“直选复式”。</li></ul>\n<p><strong>格式演示，不代表实际开奖记录。</strong>这篇文章的用途是说明系统如何解析投注文本和计算组合数量。真正进入方案文件前，还要继续经过目标玩法、覆盖率和金额等底层合规校验。</p>",
  "internal_links": [],
  "rule_refs": ["DINGMA-ROTATION-FORMAT-V1", "DINGMA-ROTATION-COUNT-V1"],
  "source_refs": ["USER-SUPPLIED-DINGMA-RULES-2026-08-11"],
  "case_scope": "mechanics_only",
  "provider_id": null,
  "lottery": null,
  "play": null,
  "technique_atoms": ["format_mechanics", "combination_counting"],
  "fingerprint": "9d55831533a78e01fac2543d13b6b4920016b97f18e483ae3152174a4d8304dc",
  "content_hash": "c928b4d4aa749a30733f9811c03ac9f5b8273d51ca54273061a8e06ee8182cff",
  "approved_at": "2026-08-11T11:30:00+00:00",
  "status": "approved"
}
