{
  "article_id": "LCM-SMOKE-20260811-02",
  "title": "分分彩定位胆怎么写？五位置和单位置格式别混用",
  "seo_title": "分分彩定位胆：五位置与万千百十个位的投注格式区别",
  "slug": "ffc-dingweidan-five-vs-single-position",
  "meta_description": "说明分分彩定位胆的两种文本结构：五位置用五组数字和连字符，单一万千百十个位用空格数字池，并解释50只是格式容量。",
  "primary_keyword": "分分彩定位胆",
  "secondary_keywords": ["定位胆投注技巧", "定位胆格式", "个位定位胆", "定位胆五位置"],
  "search_intent": "了解分分彩定位胆五位置与单位置投注格式的区别",
  "summary": "通过458-578-569-178-056和5 7 9两个例子，说明五位置定位胆与单位置定位胆为什么必须使用不同解析格式。",
  "category": "投注技巧",
  "site_category_key": "tzjq",
  "content_type": "technique_article",
  "content_format": "html",
  "tags": ["分分彩定位胆", "定位胆格式", "个位定位胆", "定码轮换"],
  "content": "<p>分分彩定位胆里，“定位胆”这个玩法名称和“万位、千位、百位、十位、个位”这些单位置玩法，虽然都属于定位类投注，但在本站定码轮换系统中使用的文本格式并不相同。混用格式，会让解析器无法确定一组数字到底属于哪个位置。</p>\n<h2>五位置定位胆：用五组数字对应五个位置</h2>\n<p>五位置格式示例是：<code>458-578-569-178-056</code>。从左到右分别对应万位、千位、百位、十位、个位。每一段都是该位置自己的候选数字集合，五段之间必须用 <code>-</code> 分隔。</p>\n<p>这个例子里一共有5个位置组，每组各有3个候选数字。它表达的是“不同位置分别选择哪些数字”，不能直接把它当成五星直选复式，更不能简单按 <code>3×3×3×3×3</code> 去计算一个统一的五星目标空间。</p>\n<h2>单位置定位胆：只写这个位置的数字池</h2>\n<p>如果玩法名称已经明确是“万位”“千位”“百位”“十位”或“个位”，格式就简化为单数字集合，用空格分隔。例如个位选择 <code>5 7 9</code>，表示这个指定位置关注数字5、7、9，不需要再补出另外四个位置。</p>\n<h2>为什么系统把两种格式分开</h2>\n<p>五位置字符串承担了“位置映射”的信息：第1段只能属于万位，第2段只能属于千位，以此类推。单位置玩法则已经由玩法名称确定位置，所以文本里只需要保存数字集合。如果把五位置格式写成 <code>458 578 569 178 056</code>，位置边界会变得不明确；如果把单位置写成五段，又会引入不存在的额外位置。</p>\n<h2>“最大50”应该怎么理解</h2>\n<p>本站规则表把五位置定位胆记录为最多 <code>5×10=50</code> 个“位置-数字”容量。这是格式容量：5个位置，每个位置都有0到9共10个数字。它<strong>不是</strong>一个单独目标中奖空间里的50个互斥结果，因此不能拿“50”直接和某个单位置的10个结果做覆盖率相加。</p>\n<p>单一万位、千位、百位、十位或个位的数学空间都是10个数字。比如个位 <code>5 7 9</code> 覆盖3个个位结果，数学覆盖率是30%。如果同时组合其他玩法，仍要先映射到同一个目标结果空间后再联合去重，不能仅按文本数量相加。</p>\n<h2>实际生成方案时的检查顺序</h2>\n<ol><li>先确认一级类别是“定码轮换”。</li><li>再确认玩法类型是“定位胆”。</li><li>最后看玩法名称到底是“定位胆”还是某一个具体位置。</li><li>根据玩法名称选择五段连字符格式或单位置空格格式。</li></ol>\n<p><strong>格式演示，不代表实际开奖记录。</strong>本文只解释文本结构和数学容量，不涉及平台金额参数。生成可执行方案时，仍需经过位置映射、覆盖去重和组合合规检查。</p>",
  "internal_links": [],
  "rule_refs": ["DINGMA-ROTATION-FORMAT-V1", "DINGMA-ROTATION-COUNT-V1"],
  "source_refs": ["USER-SUPPLIED-DINGMA-RULES-2026-08-11"],
  "case_scope": "mechanics_only",
  "provider_id": null,
  "lottery": null,
  "play": null,
  "technique_atoms": ["format_mechanics", "combination_counting"],
  "fingerprint": "5acfd00aad052b84042d6a455d41d6cfd9571cc1d57c50ab0fad61f0944882c5",
  "content_hash": "eaae4b9117e3345b860703026e9343db6e5e83b2510ea7d15a0c718107508a63",
  "approved_at": "2026-08-11T11:30:00+00:00",
  "status": "approved"
}
